id,subreddit,title,selftext,created_utc,score,num_comments,author,url,over_18,flair,sort
1l8l660,interestingasfuck,Arctic wolves checking out wildlife photographer.,,2025-06-11 06:01:36,628,55,Few_Amoeba_2362,https://v.redd.it/h3o6xoykn86f1,False,,
1l8k7r7,all,to bully the Governor of California into silence & compliance.,,2025-06-11 05:01:08,5360,261,biospheric,https://v.redd.it/n9kid12bc86f1,False,,
1l8ipht,AskReddit,What is the strangest murder that has not been solved yet?,,2025-06-11 03:35:34,325,273,No-Structure7683,https://www.reddit.com/r/AskReddit/comments/1l8ipht/what_is_the_strangest_murder_that_has_not_been/,False,,
1l8iokk,all,Empire vibes,,2025-06-11 03:34:14,8344,355,StiffDoodleNoodle,https://v.redd.it/gcui0dhax76f1,False,General Reposti,
1l8i9zf,all,Embarrassing,,2025-06-11 03:12:19,11475,471,Accomplished-King406,https://v.redd.it/enjlcndct76f1,False,Lmao gottem :pog_1:,
1l8hxbn,all,"U.S. military member joined an anti-ICE protest in Dallas, Texas and speaks out against Trump deploying Marines to Los Angeles. ""We serve the people of the United States, the Constitution. These constitutional rights are being stripped and just denied. And the military will not be pawns to that.""",,2025-06-11 02:53:56,35400,1510,kenistod,https://v.redd.it/g7bovka2q76f1,False,APPROVED B-LISTERS,
1l8hik7,AskReddit,What is the most looked over fact of WW2?,,2025-06-11 02:32:54,301,771,Sir_Balin_Lionheart,https://www.reddit.com/r/AskReddit/comments/1l8hik7/what_is_the_most_looked_over_fact_of_ww2/,False,,
1l8hekp,interestingasfuck,Iran - three years after the 2022 events,,2025-06-11 02:27:05,45562,868,Plus_Flight_3821,https://www.reddit.com/gallery/1l8hekp,False," /r/all, /r/popular",
1l8ha5n,all,Newsom Tells Nation That Trump Is Destroying American Democracy,,2025-06-11 02:20:53,29023,1088,kweathergirl,https://www.nytimes.com/2025/06/10/us/newsom-speech-trump-la-protests.html,False,Soft Paywall,
1l8h8wi,all,U.S. Military Speaks Out Against Trump Deploying Marines to LA,"After Trump deployed Marines to Los Angeles, this military member joined an anti-ICE protest in Dallas, declaring, 'We won't be pawns in stripping away constitutional rights.'",2025-06-11 02:19:10,11250,520,CMao1986,https://v.redd.it/st1ot7cwj76f1,False,US Protest News,
1l8gd4v,AskReddit,"What are your thoughts on Elon Musk tweeting that Donald Trump is mentioned in the Epstein files, and then deleting the tweet shortly after?",,2025-06-11 01:34:37,3295,1039,Temporary_Moment7908,https://www.reddit.com/r/AskReddit/comments/1l8gd4v/what_are_your_thoughts_on_elon_musk_tweeting_that/,False,,
1l8fxyq,all,He stayed for them,,2025-06-11 01:13:06,17324,254,Afraid-Objective3049,https://i.redd.it/am2s77y3876f1.png,False,:smilingface2: Family & Friends :smilingface2:,
1l8fo4d,interestingasfuck,It looks like Mexico was a bigger territory huh?,,2025-06-11 00:59:17,7218,1424,PdiddyCAMEnME,https://v.redd.it/f6xsokom576f1,False,,
1l8fmgp,all,Instant karma,,2025-06-11 00:56:53,34261,370,zabaterz,https://v.redd.it/dxe46xq7576f1,False,,
1l8fey2,AskReddit,What is honestly the first thing you think of whenever you hear the word “Texas”?,,2025-06-11 00:46:32,353,3287,Party_Leading8715,https://www.reddit.com/r/AskReddit/comments/1l8fey2/what_is_honestly_the_first_thing_you_think_of/,False,,
1l8f5kv,all,Found it in a dumpster. It hissed. It's mine.,"Can't tell if it's a boy or girl, not concerned about it either. Seems healthy, has appetite. So far so good. Next week, vet.",2025-06-11 00:33:57,28373,421,C0LLARS,https://i.redd.it/49ostom4176f1.jpeg,False,Tiny 🍊 🅱️rain cell ,
1l8dvs0,interestingasfuck,Every Apple device stolen from the Apple Store in Downtown Los Angeles last night is now sounding an alarm saying it should be returned,,2025-06-10 23:33:34,23270,818,Subject-Property-343,https://v.redd.it/a70nuxqcq66f1,False,,
1l8dupo,AskReddit,"Men, what has a woman told you that touched your heart more than you let on?",,2025-06-10 23:32:14,2191,676,kitcat1098,https://www.reddit.com/r/AskReddit/comments/1l8dupo/men_what_has_a_woman_told_you_that_touched_your/,False,,
1l8cbqb,interestingasfuck,"I’ve had this biosphere for 8 years and the shrimp inside it is still alive , the 2nd one died in 2020",,2025-06-10 22:25:09,52309,2796,vivepopo,https://i.redd.it/tz26s9d5e66f1.jpeg,False, /r/all,
1l89za8,popular,Labubu Giveaway,"I’m giving away 1 Have A Seat and the winner gets to choose whichever one they want! I am also giving away the lychee berry Macaron one! Both labubus will come with their protective cases. 

Only TWO winners will be selected via random draw in 48 hours.

To enter:
✅ Like this post
💬 Drop a comment below

Good luck, everyone! 🍀✨
",2025-06-10 20:49:24,4258,4869,spoilthesurprise,https://i.redd.it/7fgdebh2x56f1.jpeg,False,Display/OOTD/Collection,
1l89fkx,interestingasfuck,"Hard to believe this came from a wild animal, I’ve never seen anything like it.",,2025-06-10 20:27:38,9261,135,Deon_007,https://v.redd.it/xicq6mdhs56f1,False,,
1l86oak,interestingasfuck,Military vehicle transport on Ohio River,,2025-06-10 18:40:34,8518,784,snouskins,https://v.redd.it/ih6z43e1a56f1,False,,
1l86i91,interestingasfuck,Ed Kemper striking a T-pose with the officers who arrested him in 1973. He was 6'10 !,,2025-06-10 18:34:07,9042,537,Sans010394,https://i.redd.it/5he0y0ex856f1.png,False,,
1l85t05,popular,Jagex has caved to the alt-right. No seasonal event this year.,Source: Pink news. I will put a link in the comments.,2025-06-10 18:07:23,11500,3892,RenderSoft,https://www.reddit.com/gallery/1l85t05,False,Link in comments,
1l83rqj,AskReddit,"What's the worst ""nice guy"" experience you've ever had?",,2025-06-10 16:50:39,5201,1467,strangeloop414,https://www.reddit.com/r/AskReddit/comments/1l83rqj/whats_the_worst_nice_guy_experience_youve_ever_had/,False,,
1l82l43,popular,What is this strangely shaped hole in my cars cup holder for?,,2025-06-10 16:03:59,25019,4242,sadz6900,https://i.redd.it/sevbv624i46f1.jpeg,False,Solved!,
1l81nta,popular,2024 Election Results Under Scrutiny as Lawsuit Advances,,2025-06-10 15:27:40,47874,3165,Quirkie,https://www.newsweek.com/2024-election-lawsuit-advances-2083391,False,,
1l81nop,interestingasfuck,"This man is flying an Aerolite 103 personal airplane, which requires no pilot license or registration.",,2025-06-10 15:27:32,46180,1963,mindyour,https://v.redd.it/ugytz51mb46f1,False, /r/all,
1l81nix,interestingasfuck,Engineer designs toilet that gives you the proper posture,,2025-06-10 15:27:20,20488,1839,kerenskii,https://v.redd.it/2yeuvineb46f1,False,,
1l80xep,AskReddit,"What is honestly the first thing you think of when you hear the word ""Louisiana""?",,2025-06-10 14:59:20,5710,15187,quixoticelixer_mama,https://www.reddit.com/r/AskReddit/comments/1l80xep/what_is_honestly_the_first_thing_you_think_of/,False,,
1l7yoxc,AskReddit,"Those in the American Armed Forces, how do you feel about troops being used to quell unrest in-country?",,2025-06-10 13:26:09,4322,3320,NotSlayerOfDemons,https://www.reddit.com/r/AskReddit/comments/1l7yoxc/those_in_the_american_armed_forces_how_do_you/,False,,
1l7x1du,popular,what does it look like,people at my job keep on saying it looks like a spoon in a chilli pepper please tell me it doesn’t 😂😂😂,2025-06-10 12:07:56,17039,16348,aquaticwotsits,https://i.redd.it/b3ts4il0c36f1.jpeg,False,General Advice,
1l7wnov,popular,"I found this in my bathroom. It spun around for a few minutes and then died (i think because of the humidity in the bathroom) I went to find something to pick it up with, and when I came back, I saw another scorpion dead next to it.",,2025-06-10 11:48:06,24946,3455,Mostafa_zareii,https://www.reddit.com/gallery/1l7wnov,False,,
1l7wkgm,popular,"Cops accidentally euthanize $100,000 snake.. and this is how they react",,2025-06-10 11:43:06,29061,3007,Jason4qg6c,https://v.redd.it/i8tc4ol1736f1,False,,
1l7vc5k,AskReddit,"Gamers, what's the first game that scared the shit out of you?",,2025-06-10 10:33:02,6804,10895,Pboi401,https://www.reddit.com/r/AskReddit/comments/1l7vc5k/gamers_whats_the_first_game_that_scared_the_shit/,False,,
1l7v781,AskReddit,What’s the most underrated “guy code” rule?,,2025-06-10 10:24:27,5868,2151,Cold-Log4209,https://www.reddit.com/r/AskReddit/comments/1l7v781/whats_the_most_underrated_guy_code_rule/,False,,
1l8nc7w,all,"I love all of these Women's Weekly cake book posts! Here's a painting I did last year of the Dolly Varden cake from the classic cookbook. The second image is the actual cake I baked, set up in my studio to photograph it.","I've been baking the cakes from the Women's Weekly cake book, photographing, then painting them. The Dolly Varden is one I painted last year; it was the second cake I did! It's such a classic, and one that has been baked and enjoyed by many families.",2025-06-11 08:26:57,1,0,Dangerous_Bear_24,https://www.reddit.com/gallery/1l8nc7w,False,,new
1l8nc81,all,Which brand should I buy from?,"I’ve seen some posts about Lattafa and Ajmal Perfumes are those any good??
If they’re good which ones should I buy?? ",2025-06-11 08:26:57,1,1,Dream8822,https://www.reddit.com/r/DesiFragranceAddicts/comments/1l8nc81/which_brand_should_i_buy_from/,False,Advice :22_advice:,new
1l8nc82,all,Is this all you scallywags do all day? Talk about pirates?,,2025-06-11 08:26:57,1,0,Action-is-the-Juice,https://i.redd.it/pvfp3enid96f1.jpeg,False,,new
1l8nc85,all,Fireworks @1:23 AM,Did anyone hear that? Or were they gunshots? Near 26th and Kerkhoff?,2025-06-11 08:26:57,1,0,HuntIntelligent8820,https://www.reddit.com/r/SanPedro/comments/1l8nc85/fireworks_123_am/,False,,new
1l8nc7q,popular,Ideas for Chart-Practice WebApp,"So basically I wanted to build a gamified chart movement prediction application for beginners or proficient traders to test their chart knowledge. For this I created a website that would ask the user to predict the move that happened after the given time period, and then it would tell the answer and the %age movement. Now I want to make it more interesting and engaging so that it could be of any help to traders. Hence I want your opinions and suggestions on what better could be done ....  
like maybe adding some indicators or news section, something like that?

[https://chart-practice-ground.vercel.app/](https://chart-practice-ground.vercel.app/)

",2025-06-11 08:26:56,1,0,Ancient_Lake_3115,https://www.reddit.com/r/webdev/comments/1l8nc7q/ideas_for_chartpractice_webapp/,False,,new
1l8nc7n,popular,BCA Graduate (2025) from India | Seeking SOC Analyst Career Guidance,"Hi folks, I just graduated BCA. I’m focused on becoming a SOC Analyst and would love India-specific guidance.

Here’s what I’ve done so far:

Tools: Splunk, Nmap, Burp Suite Pro

OS: Kali Linux, Windows

Python: Basic scripting

Labs: TryHackMe, CyberDefenders, Wazuh setup

Networking: Basic understanding


Need help with:

Next skills/tools to focus on for SOC roles in India

Good free/affordable certifications or projects

How to find remote internships or jobs (especially from India)


Would be great to hear from others who’ve made it in this field!
",2025-06-11 08:26:56,1,0,General_Earth6533,https://www.reddit.com/r/SecurityCareerAdvice/comments/1l8nc7n/bca_graduate_2025_from_india_seeking_soc_analyst/,False,,new
1l8nc7u,all,A productivity app that focuses on Japanese aesthetics - and its free!,"Hello BU! I'm currently a student studying engineering and I wanted to show a calendar app that I'm working on. If you have any interests in Japanese culture or aesthetics, I highly recommend that you give the app a try. It's still in production but I've attached a few photos of upcoming developments. Feel free to ask me any questions here or on the kinew discord ([https://discord.gg/AHbsPXsN](https://discord.gg/AHbsPXsN))!

Desktop: [kinew.app](http://kinew.app)  
iPhone: [get.kinew.app](http://get.kinew.app)  
Android: still in the works but you can access through the desktop link and put it on your home screen!",2025-06-11 08:26:56,1,0,kbdoodle,https://www.reddit.com/gallery/1l8nc7u,False,,new
1l8nc7g,all,Ali Express Coupon Codes of June 2025,"Go to this page for [**Ali Express Coupon Codes of June 2025**](https://bit.ly/3do7V6R). If you're looking for the newest coupons and promo codes, that page is the place to go. They always have the latest offers available.",2025-06-11 08:26:55,1,0,kitgeneral9,https://www.reddit.com/r/SaveTheBest/comments/1l8nc7g/ali_express_coupon_codes_of_june_2025/,False,,new
1l8nc7m,popular,ID Request—Is this Psilocybe,"Found in Wollemi National Park, NSW, Australia",2025-06-11 08:26:55,1,1,worriedfornothingg,https://www.reddit.com/gallery/1l8nc7m,False,Australia (state/territory in post),new
1l8nc7i,all,My Piccolo vs Knuckles TN,I should've moved piccolo a little closer but it think it looks pretty good ,2025-06-11 08:26:55,1,0,IncidentSuitable6401,https://i.redd.it/z401b7rhd96f1.png,False,Matchup/Debate,new
1l8nc7e,popular,What might be the cut off in 2nd merit list Jd birla,Hello guys can you tell me the expected cut off for BCOM Jd birla 2nd merit list 😔 I am very stressed about this I really want to get in ,2025-06-11 08:26:55,1,0,Busy-Issue240,https://www.reddit.com/r/CalcuttaUniversity/comments/1l8nc7e/what_might_be_the_cut_off_in_2nd_merit_list_jd/,False,,new
1l8nc7c,popular,"""Sly Marbo"" proxy","I'm so happy with how this kitbash turned out. I had enough spare bitz that I thought I'd have a crack at putting together a cadian version of the one-man army!

Legs & torso: 5th Ed. Command squad medic
Arms & head: 9th Ed. Command squad officer
Pistol: bolt pistol with heavy stubber barrel & intercessor bolt rifle scope",2025-06-11 08:26:54,1,0,DiLuna93,https://i.redd.it/wu1n2q9id96f1.jpeg,False,Hobby & Painting,new
1l8nc77,popular,Monash guarantee,"For the Monash guarantee for engineering the ATAR requirement is 75 instead of the 85.10, on the website it says you can be eligible for a few different reasons, one of them is living in a  regional or remote area. I guess I live in a regional area and when I used the SEAS calculator it increases my ATAR, does this mean I am eligible for the Monash guarantee?",2025-06-11 08:26:54,1,0,virgin_3,https://www.reddit.com/r/Monash/comments/1l8nc77/monash_guarantee/,False,Advice,new
1l8nc7a,popular,"First training session with our new puppy, Clover",Clover is 8 weeks old and learning her name + sit and her 1.5 year old older brother Fenway is smurfing in class to get free treats ,2025-06-11 08:26:54,1,0,throwuptothrowaway,https://i.redd.it/7flr88did96f1.jpeg,False,,new
1l8nc6z,popular,Affinity Designer Tutorial - Manually Tracing with the Pen Tool,,2025-06-11 08:26:53,1,0,SpriteAttack,https://youtube.com/watch?v=ASWXn_qR2SE&feature=shared,False,,new
1l8nc5d,interestingasfuck,An iPhone's dot projection for facial scanning,,2025-06-11 08:26:47,1,0,worldsblackestmarket,https://i.redd.it/btgef92gd96f1.jpeg,False,,new
1l8nbej,interestingasfuck,Wooden brain twister got me questioning my IQ,,2025-06-11 08:25:24,1,0,Yeet_TheVoid,https://v.redd.it/ciy925g8d96f1,False,,new
1l8nbe0,AskReddit,What’s the first word you think of when you hear California?,,2025-06-11 08:25:22,0,6,ryanrako23,https://www.reddit.com/r/AskReddit/comments/1l8nbe0/whats_the_first_word_you_think_of_when_you_hear/,False,,new
1l8nb9q,AskReddit,People aged thirty and over what advice would you give too people in their 20s ?,,2025-06-11 08:25:08,1,1,MCR1996Hola,https://www.reddit.com/r/AskReddit/comments/1l8nb9q/people_aged_thirty_and_over_what_advice_would_you/,False,,new
1l8nb8h,AskReddit,Where should an anouncement be made for an warehouse for rent to AI developers/crypto mining farms?,,2025-06-11 08:25:05,1,0,HopeLess3277,https://www.reddit.com/r/AskReddit/comments/1l8nb8h/where_should_an_anouncement_be_made_for_an/,False,,new
1l8nawi,AskReddit,"Lesbians, what’s a small thing a woman did that made you melt instantly?",,2025-06-11 08:24:25,0,0,Downtown_Gap67,https://www.reddit.com/r/AskReddit/comments/1l8nawi/lesbians_whats_a_small_thing_a_woman_did_that/,False,,new
1l8nari,AskReddit,Whats a lie you told that will haunt you forever?,,2025-06-11 08:24:08,1,0,shadowquill_exe,https://www.reddit.com/r/AskReddit/comments/1l8nari/whats_a_lie_you_told_that_will_haunt_you_forever/,False,,new
1l8naqt,AskReddit,"Hi what are your thoughts on a 7,5inch length 5,5inch girth and 2inch width concerned?",,2025-06-11 08:24:06,0,0,random446676443,https://www.reddit.com/r/AskReddit/comments/1l8naqt/hi_what_are_your_thoughts_on_a_75inch_length/,True,,new
1l8nahw,AskReddit,What's something you believed as a kid that you're embarrassed you didn't figure out sooner?,,2025-06-11 08:23:36,1,0,Nandou_B,https://www.reddit.com/r/AskReddit/comments/1l8nahw/whats_something_you_believed_as_a_kid_that_youre/,False,,new
1l8naga,AskReddit,if you caught your husband wearing your panties what would you do?,,2025-06-11 08:23:31,1,0,Green_Anything_7852,https://www.reddit.com/r/AskReddit/comments/1l8naga/if_you_caught_your_husband_wearing_your_panties/,False,,new
1l8na9t,AskReddit,What’s the weirdest thing you’ve done alone in your room?,,2025-06-11 08:23:09,1,3,MonaliHot,https://www.reddit.com/r/AskReddit/comments/1l8na9t/whats_the_weirdest_thing_youve_done_alone_in_your/,False,,new
1l8n9vj,AskReddit,How Childhood Trauma Affected Your Life ?,,2025-06-11 08:22:17,1,2,Lil7363,https://www.reddit.com/r/AskReddit/comments/1l8n9vj/how_childhood_trauma_affected_your_life/,False,,new
1l8n8s4,interestingasfuck,"Axolotls stay their lifetime as a larvae! But if they grow up, they look like this. (2nd slide a Larvae)",,2025-06-11 08:20:14,3,1,SerafinZufferey,https://www.reddit.com/gallery/1l8n8s4,False,,new
1l8l610,interestingasfuck,"One of the last images of  the Japanese lander Resilience shows the south pole of the Moon, which is dotted with craters. However, some may see bumps instead of depressions.",,2025-06-11 06:01:24,23,15,Scientiaetnatura065,https://i.redd.it/3vj6havjn86f1.jpeg,False,,new
1l8klsl,interestingasfuck,Full strawberry moon sounds like a dope R&B album. Maybe them superpowers will finally kick in. I'm ready for my supervillain era.,,2025-06-11 05:25:07,0,13,MartelleJordan,https://i.redd.it/8bji1qr2h86f1.jpeg,False,,new
1l8jkym,interestingasfuck,ESO's 'Very Large Telescope' in Chile capturing stars orbiting the Milky Way's central black hole over a period of 20 years,,2025-06-11 04:23:55,224,16,4nts,https://v.redd.it/uhxff125686f1,False,,new
1l8jdm6,interestingasfuck,North and South Vietnamese flags flying at the Vietnam DMZ,,2025-06-11 04:12:22,11,3,theoceanchannel,https://i.redd.it/ly5g8853486f1.png,False,,new
1l8jcyk,interestingasfuck,Evolutionary Clock,,2025-06-11 04:11:20,106,19,Ankurkarnal05,https://i.redd.it/69lumdhv386f1.jpeg,False,,new
1l8j45d,interestingasfuck,This 2-year-old just got a crash course in physics,,2025-06-11 03:58:21,6,3,Puzzled-Category-954,https://streamain.com/jnvNf3RLWL7nRzx/watch,False,,new
1l85bj8,popular,TACO SAYS ANY PROTESTS AT HIS MILITARY PARADE WILL BE MET WITH HEAVY FORCE,,2025-06-10 17:49:28,23033,3814,Dark-Knight-Rises,https://v.redd.it/24uf3lmy056f1,False,,hot
1kfknrs,interestingasfuck,Fox asleep on my outdoor couch.,,2025-05-05 19:33:39,285165,2356,Extension-Sun-9651,https://i.redd.it/5ek7nrfqm0ze1.jpeg,False," /r/all, /r/popular",top
1ikaayo,interestingasfuck,Police escort when you kill 1 rich CEO vs when you kill 4 college students.,,2025-02-08 00:28:15,233673,2587,MobileAerie9918,https://i.redd.it/xzo07vkz7the1.jpeg,False,r/all,top
v235g0,interestingasfuck,Vietnam veteran being told how much his Rolex watch is worth,,2022-05-31 23:28:50,222966,3418,Mad_Season_1994,https://v.redd.it/nwa2b69pbw291,False,/r/ALL,top
t4cdik,interestingasfuck,"In 1996 Ukraine handed over nuclear weapons to Russia ""in exchange for a guarantee never to be threatened or invaded"".",,2022-03-01 16:51:15,350797,7732,IceBuurn,https://i.redd.it/q25xyjhvxsk81.png,False,Ukraine /r/ALL,top
t3j0tu,interestingasfuck,"Ukrainian ambassador to the UN pretty much tells Putin to kill himself: ""If he wants to kill himself, he doesn't need to use nuclear arsenal. He has to do what the guy in Berlin did in a bunker in May 1945""",,2022-02-28 16:07:32,273965,5837,PeasKhichra,https://v.redd.it/zjb48tj2llk81,False,Ukraine /r/ALL,top
sm3sdl,interestingasfuck,My turtle follows me and seeks out affection. Biologist have reached out to me because this is not even close to normal behavior. He just started one day and has never stopped. I don’t know why.,,2022-02-06 18:31:40,269864,5810,ihateandy2,https://v.redd.it/fko4j44oa9g81,False,/r/ALL,top
s6gkqt,interestingasfuck,Riding abandoned railroad tracks in Southern California with my railcart,,2022-01-17 22:15:16,219927,4033,RphilRT,https://v.redd.it/f6iekvibobc81,False,/r/ALL,top
oaw4v8,interestingasfuck,"“The dog on the Left is award winning showdog named Arnie an AKC French Bulldog..The dog on the right is Flint, bred in the Netherlands by Hawbucks French Bulldogs - a breeder trying to establish a new, healthier template for French Bulldogs.”",,2021-06-30 12:18:46,269079,6960,MattyIce6969,https://i.redd.it/ln1g7d1wae871.jpg,False,/r/ALL,top
n39zq5,interestingasfuck,I created a photorealistic image of George Washington if he lived in the present day.,,2021-05-02 16:26:00,252673,6977,KingBaboon97,https://i.redd.it/kaopcso5hqw61.jpg,False,/r/ALL,top
l8rf4k,popular,Times Square right now,,2021-01-30 18:00:38,492437,14084,SomeGuyInDeutschland,https://v.redd.it/x64z70f7eie61,False,YOLO,top
l78uct,popular,GME YOLO update — Jan 28 2021,,2021-01-28 21:06:23,301667,22948,DeepFuckingValue,https://i.redd.it/opzucppb15e61.png,False,YOLO,top
l7530r,AskReddit,"How would you feel about Reddit adding 3 NSFW filters to distinguish between porn, gore, and repetitive posts asking how you would feel about Reddit adding 2 NSFW filters to distinguish between porn and gore?",,2021-01-28 18:51:22,217919,2886,SoupIsAHotSmoothie,https://www.reddit.com/r/AskReddit/comments/l7530r/how_would_you_feel_about_reddit_adding_3_nsfw/,True,,top
l6wu59,all,UPVOTE so everyone sees we got SUPPORT,,2021-01-28 13:40:34,339311,12811,vrweensy,https://i.redd.it/sgoqy8nyt2e61.png,False,News,top
kr8op6,AskReddit,"How would you feel about a ""if you accidentally scroll to the top, you can go back to where you were,"" button for Reddit?",,2021-01-05 21:47:54,182974,4302,Cheap_Double9726,https://www.reddit.com/r/AskReddit/comments/kr8op6/how_would_you_feel_about_a_if_you_accidentally/,False,,top
kka536,AskReddit,"What if Earth is like one of those uncontacted tribes in South America, like the whole Galaxy knows we're here but they've agreed not to contact us until we figure it out for ourselves?",,2020-12-26 01:41:25,152117,8564,slim_p_,https://www.reddit.com/r/AskReddit/comments/kka536/what_if_earth_is_like_one_of_those_uncontacted/,False,,top
jptqj9,popular,Joe Biden elected president of the United States,,2020-11-07 16:28:37,365122,28252,throwawaynumber53,https://apnews.com/article/election-2020-joe-biden-north-america-national-elections-elections-7200c2d4901d8e47f1302954685a737f,False,,top
iwedc5,AskReddit,"What if God came down one day and said ""It's pronounced 'Jod' then left?",,2020-09-20 14:01:51,195920,10223,esi_disi,https://www.reddit.com/r/AskReddit/comments/iwedc5/what_if_god_came_down_one_day_and_said_its/,False,,top
himsju,AskReddit,"Bill Gates said, ""I will always choose a lazy person to do a difficult job because a lazy person will find an easy way to do it."" What's a real-life example of this?",,2020-06-30 12:53:42,154345,14758,lauvnoodles,https://www.reddit.com/r/AskReddit/comments/himsju/bill_gates_said_i_will_always_choose_a_lazy/,False,,top
haucpf,all,"I’ve found a few funny memories during lockdown. This is from my 1st tour in 89, backstage in Vegas.",,2020-06-17 16:17:27,438824,18884,ReallyRickAstley,https://i.redd.it/f58v4g8mwh551.jpg,False,,top
gyfedz,all,A short story,,2020-06-07 16:27:35,417284,4375,rextraneous,https://i.redd.it/70zdjiilli351.jpg,False,#2 MotW,top
gw1jbg,interestingasfuck,"In England you sometimes see these ""wavy"" brick fences. And curious as it may seem, this shape uses FEWER bricks than a straight wall. A straight wall needs at least two layers of bricks to make is sturdy, but the wavy wall is fine thanks to the arch support provided by the waves.",,2020-06-03 20:08:04,257385,3092,smell1s,https://i.redd.it/3w64cq5a5r251.jpg,False,/r/ALL,top
f08dxb,AskReddit,"Would you watch a show where a billionaire CEO has to go an entire month on their lowest paid employees salary, without access to any other resources than that of the employee? What do you think would happen?",,2020-02-07 09:53:32,197601,13325,txhorns1330,https://www.reddit.com/r/AskReddit/comments/f08dxb/would_you_watch_a_show_where_a_billionaire_ceo/,False,,top
draola,AskReddit,"How would you feel about a feature where if someone upvotes a crosspost, the original post is upvoted automatically?",,2019-11-04 01:57:46,186434,2771,Ka1-,https://www.reddit.com/r/AskReddit/comments/draola/how_would_you_feel_about_a_feature_where_if/,False,,top
ablzuq,AskReddit,"People who haven't pooped in 2019 yet, why are you still holding on to last years shit?",,2019-01-01 21:06:27,222003,7924,ShoddySubstance,https://www.reddit.com/r/AskReddit/comments/ablzuq/people_who_havent_pooped_in_2019_yet_why_are_you/,False,,top
