id,subreddit,title,selftext,created_utc,score,num_comments,author,url,over_18,flair,sort
9whgf4,AskReddit,Stan Lee has passed away at 95 years old,"As many of you know today is day that many of us have dreaded. Stan Lee has passed away at the age of 95. He leaves behind a legacy of superheroes and stories that have touched many people's lives for decades. We wanted to make this thread to honor and remember this wonderful man, so please use it discuss his life, his work, [his cameos](https://thumbs.gfycat.com/RapidClearDungenesscrab-small.gif), etc and what they meant to you. 

Excelsior!

-The AskReddit mods",2018-11-12 19:54:27,175368,27627,-eDgAR-,https://www.reddit.com/r/AskReddit/comments/9whgf4/stan_lee_has_passed_away_at_95_years_old/,False,Breaking News,top
9gx68l,AskReddit,"Reddit, how would you feel about a law that bans radio stations from playing commercials with honking/beeping/siren noises in them?",,2018-09-18 18:01:18,160344,6723,san69cor,https://www.reddit.com/r/AskReddit/comments/9gx68l/reddit_how_would_you_feel_about_a_law_that_bans/,False,,top
90bu6w,all,Heat index was 110 degrees so we offered him a cold drink. He went for a full body soak instead,,2018-07-20 01:44:38,339582,4408,FootLoosePickleJuice,https://v.redd.it/gyh95hiqc0b11,False,,top
88ll08,all,This is what happens when one company owns dozens of local news stations,,2018-03-31 20:52:13,297532,11307,patientbearr,https://youtu.be/hWLjYJ4BzvI,False,,top
7mjw12,all,My cab driver tonight was so excited to share with me that he’d made the cover of the calendar. I told him I’d help let the world see,,2017-12-28 03:00:55,308582,2447,the_Diva,https://i.redd.it/tojcmbvjwk601.jpg,False,,top
62sjuh,all,"The Senate. Upvote this so that people see it when they Google ""The Senate"".",,2017-04-01 12:57:54,438839,5177,serventofgaben,http://i.imgur.com/ChYwfMq.jpg,False,,top
5gn8ru,popular,Guardians of the Front Page,,2016-12-05 17:41:14,283989,4933,iH8myPP,http://i.imgur.com/OOFRJvr.gifv,False,Best of 2016 Winner,top
